{
  "schema_version": 1,
  "agent_id": "agent-L5-01",
  "phase": "L5",

  "facts_add": [
    {
      "key": "fact:rest-validates-int",
      "claim": "the REST handler coerces author_exclude to an integer array before reaching the query builder",
      "evidence_refs": ["src/rest/handler.php:88"],
      "confidence": "medium"
    }
  ],

  "assumptions_add": [
    {
      "key": "assumption:author-exclude-int-array",
      "claim": "every caller passes an integer array into author_exclude",
      "source_refs": ["src/rest/handler.php:88"]
    }
  ],

  "questions_add": [
    {
      "key": "oq:alternate-caller-bypass",
      "question": "does an alternate caller reach the query builder without the REST validation?",
      "priority": "P0",
      "related_candidates": ["cand-031"],
      "related_capabilities": ["cap:control-sql-expression"]
    }
  ],

  "blocked_paths_add": [
    {
      "key": "bp:cand-031-array-validation",
      "candidate_id": "cand-031",
      "blocker": {
        "type": "input_validation",
        "claim": "the normal REST path only accepts an integer array",
        "assumption_ref": "assumption:author-exclude-int-array"
      },
      "status": "blocked",
      "priority": "high",
      "reopen_if": ["assumption:author-exclude-int-array is disproved"],
      "evidence_refs": ["src/rest/handler.php:88"]
    }
  ],

  "capabilities_add": [
    {
      "key": "cap:control-scalar-parameter",
      "name": "control_scalar_parameter",
      "status": "verified",
      "source_candidates": ["cand-031"],
      "evidence_refs": ["src/cli/import-command.php:41"]
    },
    {
      "key": "cap:control-sql-expression",
      "name": "control_sql_expression",
      "status": "proposed",
      "source_candidates": ["cand-031"]
    }
  ],

  "edges_add": [
    {
      "key": "edge:scalar-to-sql",
      "from": "cap:control-scalar-parameter",
      "to": "cap:control-sql-expression",
      "relation": "enables",
      "status": "proposed",
      "via_candidate": "cand-031"
    }
  ],

  "intents_add": [
    {
      "key": "intent:prerequisite-search:BP-001",
      "question_ref": "oq:alternate-caller-bypass",
      "strategy": "prerequisite-search",
      "priority": "P0",
      "reason": "high-priority blocked path bp:cand-031-array-validation keeps cand-031 out of the chain"
    }
  ]
}
